{
  "slug": "fixture-revision-extend-unknown-city",
  "title": "5 days in Japan: Tokyo, Kyoto",
  "generated_on": "19-09-2026",
  "brief": {
    "request": "Plan a 5-day trip to Japan. Tokyo + Kyoto. $3,000 budget. Love food and temples, hate crowds.",
    "destination": "Japan",
    "days": 5,
    "cities": [
      "Tokyo",
      "Kyoto"
    ],
    "budget_usd": 3000,
    "likes": [
      "food",
      "temples"
    ],
    "avoids": [
      "crowds"
    ],
    "start_date": "22-09-2026",
    "travellers": 1,
    "slug": "sample-japan"
  },
  "days": [
    {
      "day": 1,
      "date": "22-09-2026",
      "city": "Tokyo",
      "area": "Nezu / Yanaka",
      "slots": [
        {
          "when": "morning",
          "name": "Meiji Jingu",
          "kind": "temple",
          "why": "Forest shrine, quiet spiritual grounds, fits temples",
          "crowd_tactic": "Arrive 07:30, before tour buses and school groups",
          "transit_min_from_prev": null,
          "est_cost_usd": 5.5,
          "source": "tool",
          "url": "https://maps.google.com/?cid=10361244767556222835",
          "area": "Nezu / Yanaka"
        },
        {
          "when": "afternoon",
          "name": "Tokyo Ramen Street",
          "kind": "food",
          "why": "Ramen from several stalls under Tokyo Station, fits food",
          "crowd_tactic": "Weekday, before 11:30 or after 14:00, avoid Saturday and Sunday lunch peak",
          "transit_min_from_prev": 102,
          "est_cost_usd": 22.5,
          "source": "tool",
          "url": "https://maps.google.com/?cid=10979141230727447234",
          "area": "Nezu / Yanaka"
        },
        {
          "when": "evening",
          "name": "Yakitori Alley",
          "kind": "food",
          "why": "Local grilled skewer alley, fits food",
          "crowd_tactic": "Go before 18:00, weekday evenings are quieter",
          "transit_min_from_prev": 18,
          "est_cost_usd": 22.5,
          "source": "tool",
          "url": "https://maps.google.com/?cid=1146276811127959512",
          "area": "Nezu / Yanaka"
        }
      ]
    },
    {
      "day": 2,
      "date": "23-09-2026",
      "city": "Tokyo",
      "area": "Nezu / Yanaka",
      "slots": [
        {
          "when": "morning",
          "name": "Zojo-ji",
          "kind": "temple",
          "why": "Temple with Tokyo Tower backdrop, fits temples",
          "crowd_tactic": "Arrive 08:00, before tour groups",
          "transit_min_from_prev": null,
          "est_cost_usd": 5.5,
          "source": "tool",
          "url": "https://maps.google.com/?cid=9846179875119807780",
          "area": "Nezu / Yanaka"
        },
        {
          "when": "afternoon",
          "name": "Pocha Korean Street Food",
          "kind": "food",
          "why": "Street-food style local eatery, fits food",
          "crowd_tactic": "Visit off-peak, 15:00 to 17:00",
          "transit_min_from_prev": 120,
          "est_cost_usd": 22.5,
          "source": "tool",
          "url": "https://maps.google.com/?cid=10276194420627875328",
          "area": "Nezu / Yanaka"
        },
        {
          "when": "evening",
          "name": "Toranomon Yokocho",
          "kind": "food",
          "why": "Izakaya small plates, less touristy than the Shinjuku alleys",
          "crowd_tactic": "Early dinner, 17:30",
          "transit_min_from_prev": 111,
          "est_cost_usd": 22.5,
          "source": "tool",
          "url": "https://maps.google.com/?cid=5231569841113892392",
          "area": "Nezu / Yanaka"
        }
      ]
    },
    {
      "day": 3,
      "date": "24-09-2026",
      "city": "Kyoto",
      "area": "Shimogyo Ward",
      "slots": [
        {
          "when": "morning",
          "name": "Shinkansen, Tokyo to Kyoto (Nozomi)",
          "kind": "transit",
          "why": "Direct rail connection from Tokyo to the Kyoto base for the rest of the trip, 195 min = 135 seeded ride + 60 min station/transfer allowance (estimate)",
          "crowd_tactic": "n/a, not a venue",
          "transit_min_from_prev": 195,
          "est_cost_usd": 88.48,
          "source": "seed",
          "url": null,
          "area": "Shimogyo Ward"
        },
        {
          "when": "afternoon",
          "name": "Otagi Nenbutsuji",
          "kind": "temple",
          "why": "Quiet 1,200-statue temple in the Arashiyama hills, fits temples and avoids crowds",
          "crowd_tactic": "Instead of Kinkaku-ji, choose this quiet alternative",
          "transit_min_from_prev": 139,
          "est_cost_usd": 5.5,
          "source": "tool",
          "url": "https://maps.google.com/?cid=6320713090685638098",
          "area": "Shimogyo Ward"
        },
        {
          "when": "evening",
          "name": "chao chao gyoza kyoto",
          "kind": "food",
          "why": "Highly rated gyoza spot, fits food",
          "crowd_tactic": "Go before 18:00 to skip the dinner queue",
          "transit_min_from_prev": 139,
          "est_cost_usd": 45.0,
          "source": "tool",
          "url": "https://maps.google.com/?cid=2783494925524911278",
          "area": "Shimogyo Ward"
        }
      ]
    },
    {
      "day": 4,
      "date": "25-09-2026",
      "city": "Kyoto",
      "area": "Shimogyo Ward",
      "slots": [
        {
          "when": "morning",
          "name": "Fushimi Inari Taisha",
          "kind": "temple",
          "why": "Iconic torii-gate shrine, fits temples",
          "crowd_tactic": "Arrive 06:30, before tour buses, walk past the third torii cluster where crowds thin",
          "transit_min_from_prev": null,
          "est_cost_usd": 5.5,
          "source": "tool",
          "url": "https://maps.google.com/?cid=8870624639634301673",
          "area": "Shimogyo Ward"
        },
        {
          "when": "afternoon",
          "name": "To-ji Temple",
          "kind": "temple",
          "why": "Quieter temple, five-story pagoda, monthly antique market, fits temples and avoids crowds",
          "crowd_tactic": "Visit on a non-market weekday for solitude",
          "transit_min_from_prev": 49,
          "est_cost_usd": 5.5,
          "source": "tool",
          "url": "https://maps.google.com/?cid=15271193799445412112",
          "area": "Shimogyo Ward"
        },
        {
          "when": "evening",
          "name": "Kiyamachi-Kawaramachi dining strip",
          "kind": "food",
          "why": "Gyoza, ramen, izakaya small plates, fits food",
          "crowd_tactic": "Early dinner, 17:30, weekday visit, avoid Friday and Saturday night crowds",
          "transit_min_from_prev": 65,
          "est_cost_usd": 45.0,
          "source": "tool",
          "url": "https://maps.google.com/?cid=10680744316999396392",
          "area": "Shimogyo Ward"
        }
      ]
    }
  ],
  "stays": [
    {
      "city": "Tokyo",
      "nights": 2,
      "area": "Nezu / Yanaka",
      "why": "first two nights",
      "est_nightly_usd": 95.0,
      "examples": [
        {
          "name": "HOTEL GRAPHY NEZU",
          "rating": 4.3,
          "price_level": null,
          "url": "https://maps.google.com/?cid=6955171263224555104"
        }
      ]
    },
    {
      "city": "Kyoto",
      "nights": 2,
      "area": "Shimogyo Ward",
      "why": "last two nights",
      "est_nightly_usd": 95.0,
      "examples": [
        {
          "name": "KIORI Exec Muromachi Hotel",
          "rating": 4.8,
          "price_level": null,
          "url": "https://maps.google.com/?cid=7758284965727017128"
        }
      ]
    }
  ],
  "intercity": [
    {
      "from": "Tokyo",
      "to": "Kyoto",
      "mode": "Train",
      "duration_min": 195,
      "fare_usd": 88.48,
      "source": "seed"
    }
  ],
  "budget": {
    "limit_usd": 3000,
    "total_usd": 848.63,
    "within_budget": true,
    "lines": [
      {
        "category": "stay",
        "usd": 380.0,
        "basis": "4 nights x midpoint $95.00 (band $70-120 from 03-budget.md, hotel price level unavailable from tool)"
      },
      {
        "category": "transport",
        "usd": 133.48,
        "basis": "Shinkansen fare from 02-logistics.md (seed) $88.48 + 5 days x local transit midpoint $9.00 (band $6-12) = $45.00"
      },
      {
        "category": "food",
        "usd": 225.0,
        "basis": "5 days x midpoint $45.00 (band $30-60 from 03-budget.md)"
      },
      {
        "category": "activities",
        "usd": 33.0,
        "basis": "6 temple entries scheduled (Meiji Jingu, Zojo-ji, Otagi Nenbutsuji, Fushimi Inari Taisha, To-ji Temple, Ryoan-ji) x midpoint $5.50 (band $3-8)"
      },
      {
        "category": "buffer",
        "usd": 77.15,
        "basis": "10% of the $771.48 subtotal above"
      }
    ],
    "alternatives": [
      "Upgrade to reserved Shinkansen seats and add a private airport or station transfer.",
      "Add a guided day trip to Nara or Arashiyama with temple access, avoids crowds and adds depth.",
      "Upgrade the hotel category or add a kaiseki dinner experience in Kyoto."
    ],
    "fx": {
      "rate": 157.89,
      "date": "18-09-2026",
      "currency": "JPY"
    }
  },
  "crowd_strategy": [
    "Early-morning temple visits: Meiji Jingu at 07:30, Zojo-ji at 08:00, Fushimi Inari Taisha at 06:30 and Ryoan-ji at its 08:00 opening, all timed before tour buses and school groups arrive.",
    "Off-peak food picks: Tokyo Ramen Street on a weekday before 11:30 or after 14:00, and Toranomon Yokocho at its 17:30 opening, both timed to dodge the lunch and after-work rush windows.",
    "Lesser-known alternatives over the busiest icons: Otagi Nenbutsuji instead of Kinkaku-ji, and To-ji Temple chosen for a non-market weekday over the more crowded central Kyoto temple circuit.",
    "Reserved Nozomi Shinkansen seats for the Tokyo to Kyoto leg, instead of relying on unreserved cars."
  ],
  "review": {
    "pass": false,
    "checks": [
      {
        "id": "days_fit",
        "label": "Fits in 5 days",